Title,Title_link,partial_entry,rev_wrap,Headline,Field1
Rude staff,https://www.tripadvisor.com/ShowUserReviews-g186338-d1016181-r462787913-Tibits-London_England.html,"Visited here before going to the ice bar,very pleased with the food although can't quite grasp the idea of weighing your plate as you pay for what you eat im sure for example wedges weigh more than salad!never got a friendly welcome and it wasn't...More,Dear Lacey,

Thank you for visiting tibits and for your review. We are very surprised you didn't had a warm welcome. We will definitely raise this issue and make sure it will not happen again. Regarding your choice of wine, as you didn't like it,...More",Date of visit: February 2017,Rude staff,"Visited here before going to the ice bar,very pleased with the food although can't quite grasp the idea of weighing your plate as you pay for what you eat im sure for example wedges weigh more than salad!never got a friendly welcome and it wasn't busy,,asked for rose wine a medium but she just said this is!!!!thewine was cloudy and very dry,disgustingly bitter!!I paid £17forlunch,it really wasn't worth that and maybe a smile from the staff would of made the visit betterI am myself a catering manager And wouldn't think twice of retraining these staffWouldn't visit again purely for that reason."
Loved it,https://www.tripadvisor.com/ShowUserReviews-g186338-d1016181-r461940719-Tibits-London_England.html,"This is definitely the best restaurant ever. As a vegetarian for 26 years now it is not easy to find a restaurant with lots of options and Tibits just had everything I needed. A+,Dear tibits lover,

Thank you so much for your review. We really appreciate that you loved our offer and concept. Please come back as we just launched our new Spring menu .",Date of visit: December 2016,Loved it,This is definitely the best restaurant ever. As a vegetarian for 26 years now it is not easy to find a restaurant with lots of options and Tibits just had everything I needed. A+
Nice but a bit expensive,https://www.tripadvisor.com/ShowUserReviews-g186338-d1016181-r459954481-Tibits-London_England.html,"Visited with family on a saturday early afternoon and the place was busy. The buffet offers a wide variety of dishes, starters and main, cold and hot AND mostly vegan.
I thorougly enjoyed mine but I find it was a bit expensive for the amount...More,Dear Gwladis,

Thank you for visiting tibtis and for your review. We are happy you liked your experience with us and enjoyed the food. Regarding the bottled water, please do not hesitate to ask for tap water, as we have a free fountain available for...More",Date of visit: February 2017,Nice but a bit expensive,"Visited with family on a saturday early afternoon and the place was busy. The buffet offers a wide variety of dishes, starters and main, cold and hot AND mostly vegan.I thorougly enjoyed mine but I find it was a bit expensive for the amount of food I got - priced by weight.Also, I just asked for water and expected Tap water but was given a £3 bottle instead (my bad though, I should have refused it).Overall, good quality and tasty food. Will definitely come back as a treat because it was very nice and I didn't try the desserts or juices!"
,,,,,
Amazing.....,https://www.tripadvisor.com/ShowUserReviews-g186338-d1016181-r459711204-Tibits-London_England.html,"I'm a vege and have to say this is the best place I have been EVER fresh food variety choice amazing taste sensation,Dear Charlie,

Thank you for your review. We hope to see you again soon to try our new menu.",Date of visit: February 2017,Amazing.....,I'm a vege and have to say this is the best place I have been EVER fresh food variety choice amazing taste sensation
Nice vegetarian place,https://www.tripadvisor.com/ShowUserReviews-g186338-d1016181-r459318339-Tibits-London_England.html,"Very tasty and nice food. Tons of choice to choose from the boat. Hot and cold types. Nice drinks. Expensive but worth it. You take the food and put on a weighing scale and you get charged for it. 
Was a nice experience.",Date of visit: February 2017,Nice vegetarian place,Very tasty and nice food. Tons of choice to choose from the boat. Hot and cold types. Nice drinks. Expensive but worth it. You take the food and put on a weighing scale and you get charged for it. Was a nice experience.
First visit,https://www.tripadvisor.com/ShowUserReviews-g186338-d1016181-r459317589-Tibits-London_England.html,"I've never been to a vegetarian/vegan restaurant before. We came here for Saturday lunch after visiting the Icebar which is a stones throw away. We enjoyed the food, but found it strange having to have the plate of food weighed, especially as most buffets I've...More",Date of visit: January 2017,First visit,"I've never been to a vegetarian/vegan restaurant before. We came here for Saturday lunch after visiting the Icebar which is a stones throw away. We enjoyed the food, but found it strange having to have the plate of food weighed, especially as most buffets I've tried are all you can eat. This also means the food is getting cold while you are queuing to pay."
fine food,https://www.tripadvisor.com/ShowUserReviews-g186338-d1016181-r456543351-Tibits-London_England.html,this is a place where to get fine food in a nice surronding. Great choice since it's a self service buffet and bill is according to how much it's on the plate.,Date of visit: January 2017,fine food,this is a place where to get fine food in a nice surronding. Great choice since it's a self service buffet and bill is according to how much it's on the plate.
Very nice but not cheap,https://www.tripadvisor.com/ShowUserReviews-g186338-d1016181-r455941048-Tibits-London_England.html,"Not your typical vegan restaurant, this is modern, good location and the food was great. Self service buffet where most choices are vegan, some contain dairy or eggs but all are clearly labeled. 

Staff were friendly. Only down side is that food is sold by...More",Date of visit: January 2017,Very nice but not cheap,"Not your typical vegan restaurant, this is modern, good location and the food was great. Self service buffet where most choices are vegan, some contain dairy or eggs but all are clearly labeled. Staff were friendly. Only down side is that food is sold by weight so does work out expensive if you pile it up like me!"
Great food,https://www.tripadvisor.com/ShowUserReviews-g186338-d1016181-r455738981-Tibits-London_England.html,"Although the food was delicious, it was slightly over-priced. Especially as it is a self-service restaurant. Regardless, we still had a wonderful time and walked out feeling satisfied!",Date of visit: January 2017,Great food,"Although the food was delicious, it was slightly over-priced. Especially as it is a self-service restaurant. Regardless, we still had a wonderful time and walked out feeling satisfied!"
"Delicious options, messy plate!",https://www.tripadvisor.com/ShowUserReviews-g186338-d1016181-r455277862-Tibits-London_England.html,"The food is delicious and variety is great but putting all in one plate is something not that good for the eye. Wish they had plates with couple of divisions, so that you could at least separate salads from hot dishes.",Date of visit: January 2017,"Delicious options, messy plate!","The food is delicious and variety is great but putting all in one plate is something not that good for the eye. Wish they had plates with couple of divisions, so that you could at least separate salads from hot dishes."
Try something different,https://www.tripadvisor.com/ShowUserReviews-g186338-d1016181-r455152056-Tibits-London_England.html,I'm neither vegetarian nor vegan but  tried out this restaurant with a vegetarian friend. I really enjoyed the food which is very tasty with masses of choice. Couldn't quite give 5/5 though as it's overpriced especially as it's a buffet and having to wait for...More,Date of visit: January 2017,Try something different,I'm neither vegetarian nor vegan but tried out this restaurant with a vegetarian friend. I really enjoyed the food which is very tasty with masses of choice. Couldn't quite give 5/5 though as it's overpriced especially as it's a buffet and having to wait for the plate to be weighed and paid for meant the hot food was luke warm before we'd even sat down! Having said that I would try it again.
Tasty food but some dishes had run out,https://www.tripadvisor.com/ShowUserReviews-g186338-d1016181-r453827277-Tibits-London_England.html,We turned up about 2pm on a Saturday and it was very busy. Needed gluten free for OH and it was easy to choose as those containing gluten are marked with a G. There was a very limited choice though of dishes that weren't an...More,Date of visit: January 2017,Tasty food but some dishes had run out,"We turned up about 2pm on a Saturday and it was very busy. Needed gluten free for OH and it was easy to choose as those containing gluten are marked with a G. There was a very limited choice though of dishes that weren't an accompaniment (green beans, salads etc). Two or three main dishes were empty and not being refilled although a chef was around - I assume they'd run out. Our plates came to £8 each and everything was very tasty. Can also recommend the white riocha. Great flavour wine that went perfectly with the spicy foods. Was worried about visiting the loos having seen an earlier comment. No problem, clean and modern."
"Good food, nice atmosphere",https://www.tripadvisor.com/ShowUserReviews-g186338-d1016181-r452930303-Tibits-London_England.html,"We went here on a Saturday for early lunch. There were four adults and two babies, they brought us high-chairs and had seated us downstairs in the quieter section. There's even a kids corner with books and toys. You rarely find a central London restaurant...More",Date of visit: January 2017,"Good food, nice atmosphere","We went here on a Saturday for early lunch. There were four adults and two babies, they brought us high-chairs and had seated us downstairs in the quieter section. There's even a kids corner with books and toys. You rarely find a central London restaurant so kid friendly. Even so, the atmosphere was calm and there weren't many kids. Also I'm claustrophobic and normally hate sitting downstairs in windowless rooms but there was a huge skylight! Really nice.Now the food:Yes it is expensive for what you're getting. Since you pay by weight then if you fill your plate with potato wedges and rice which don't cost much to make and aren't exactly fine dining, then you'll be annoyed when it comes to fifteen quid. But if you get gorgeous little helpings of baba ganoush, delicate curries and pickles and coleslaws then it seems ok for the price. The African peanut pumpkin curry was amazing.Also they don't make you pay for bread rolls and you take them off your plate before weighing it so if you want to fill up on carbs alongside your fancy feast then use bread; not wedges!The desserts were wonderful. My partner is a vegan and hasn't had dessert in a restaurant in such a long time! But they have lovely creamy vegan desserts and loads of normal veggie ones too. He had sticky toffee pudding with vegan vanilla cream. I had banoffee pie and it was great.We luckily missed the queue because we were so early but by the time we were leaving a huge queue was forming to pay for plates. The coffee was very nice too."
,,,,,
Always fresh,https://www.tripadvisor.com/ShowUserReviews-g186338-d1016181-r452755509-Tibits-London_England.html,"I have been to Tibits about 30-40 times (not exaggerating) and I always bring friends and family here. I keep coming back because there will always be something new there that I haven't tasted before, the dishes are seasonal, it is always fresh and no...More",Date of visit: January 2017,Always fresh,"I have been to Tibits about 30-40 times (not exaggerating) and I always bring friends and family here. I keep coming back because there will always be something new there that I haven't tasted before, the dishes are seasonal, it is always fresh and no dish is ever empty and I love the atmosphere here. Will continue to come back, I have never been disappointed by this place!"
Fabulous Food and Third World Toilets!,https://www.tripadvisor.com/ShowUserReviews-g186338-d1016181-r452147340-Tibits-London_England.html,"I have visited Tibits many, many times but on my recent visit I went to the Ladies room before Lunch and sadly, I was put off lunch completely! The toilets were a disgrace and completely unusable. They had not been cleaned that day and maybe...More",Date of visit: January 2017,Fabulous Food and Third World Toilets!,"I have visited Tibits many, many times but on my recent visit I went to the Ladies room before Lunch and sadly, I was put off lunch completely! The toilets were a disgrace and completely unusable. They had not been cleaned that day and maybe even the day before...The lunch, as always, was fabulous but honestly, I could hardly eat.....Please Tibits, get your hygiene sorted."
A vegetarian/vegan restaurant off Oxford Circus,https://www.tripadvisor.com/ShowUserReviews-g186338-d1016181-r452144063-Tibits-London_England.html,"I live in Sussex and work in London. Tibits is one of my favourite restaurants in London.

Our home is vegetarian. In many restaurants, vegetarians get little choice. Tibits changes this. There is a hot and cold vegetarian and vegan buffet, with no menu. You...More",Date of visit: November 2016,A vegetarian/vegan restaurant off Oxford Circus,"I live in Sussex and work in London. Tibits is one of my favourite restaurants in London.Our home is vegetarian. In many restaurants, vegetarians get little choice. Tibits changes this. There is a hot and cold vegetarian and vegan buffet, with no menu. You are given a plate and choose as much as you like of what you like for breakfast, lunch or dinner.You don't compromise with so many choices, so you get the meal you want. The pricing is by weight, so you choose and then pay less or more.Fresh, delicious, healthy and easy-going. Highly recommended!"
"Fabulous food, great for vegans and veggies",https://www.tripadvisor.com/ShowUserReviews-g186338-d1016181-r450355562-Tibits-London_England.html,"You choose from a very large variety of dishes and pay simply by weight.

Food on offer is almost all vegan, and selections I have never come across, as well as more familiar. You can have potato wedges to beetroot hummus, falafel to mango curry...More",Date of visit: January 2017,"Fabulous food, great for vegans and veggies","You choose from a very large variety of dishes and pay simply by weight.Food on offer is almost all vegan, and selections I have never come across, as well as more familiar. You can have potato wedges to beetroot hummus, falafel to mango curry - a choice too wide to get on one plate!The atmosphere is friendly and seating comfortable. My only criticism is that the lift to the downstairs toilets is used to transport used crockery etc and blocked for use.We will be returning to Tibits, what a lovely place!"
A great surprise,https://www.tripadvisor.com/ShowUserReviews-g186338-d1016181-r448949489-Tibits-London_England.html,"My husband discovered this gem. It's great for a small eater like me who also prefers vegetarian food. In general, the food was great but I must mention the apple/ginger salad, the vegetable tartar, and the aubergine amaranth. And the vegetable biryani brought back fond...More",>,A great surprise,"My husband discovered this gem. It's great for a small eater like me who also prefers vegetarian food. In general, the food was great but I must mention the apple/ginger salad, the vegetable tartar, and the aubergine amaranth. And the vegetable biryani brought back fond memories of my grandmother's cooking. In other words, it was outstanding. We found it reasonably priced and in our short trip, went there three times. It's a saved destination."
Overpriced and Average Food,https://www.tripadvisor.com/ShowUserReviews-g186338-d1016181-r448838105-Tibits-London_England.html,"I visited on Boxing Day for an early lunch before shopping in the sales. It was my 2nd attempt at visiting as the first time was a Saturday afternoon around 4 weeks previous and it was very busy. 

Unfortunately I will not be returning to...More",Date of visit: December 2016,Overpriced and Average Food,"I visited on Boxing Day for an early lunch before shopping in the sales. It was my 2nd attempt at visiting as the first time was a Saturday afternoon around 4 weeks previous and it was very busy. Unfortunately I will not be returning to this Restaurant.I had what amounted to 2 bits of broccoli quiche, a couple of wedges, a couple of onion rings, a dollop of babaganoush and a spoon of potato Salad. I almost had a heart attack when the items came to £14.10In a similar class of restaurant, for that type and portion of food I would have thought around 6 or 7 pounds would have been a reasonable maximum cost.I understand that the restaurant has a central London location, and has a weigh method of pricing, but if i was not hungry I would have asked the guy at the till if he was joking and changed my mind. Total rip off, unbelievable. I felt robbed and I'm just glad i did not go through the same horror mixed with a massive que to get served. The food was average and I have had a much better meal at Mildreds Vegetarian Restaurant close by at less cost and better service and none of the que up with your plate to pay drama.I think for the cost of £14.10 it should have been an all you can eat buffet. I''m baffled at how much you charge for a bit of broccoli quiche with wedges and salad.Don't go there expecting good value nice food, but do expect to be frustrated if you are hungry and have to que to weigh and pay."
Modern stylish delicious impressive vegan | vegetarian buffet,https://www.tripadvisor.com/ShowUserReviews-g186338-d1016181-r448517475-Tibits-London_England.html,"My millennial cousins (once removed) suggested Tibits to suit the tastes of a few of us and stay within a reasonable budget. I was impressed by the sophisticated decor, very upscale. There was a vast selection of creative vegetarian dishes to choose from served buffet...More",Date of visit: November 2016,Modern stylish delicious impressive vegan | vegetarian buffet,"My millennial cousins (once removed) suggested Tibits to suit the tastes of a few of us and stay within a reasonable budget. I was impressed by the sophisticated decor, very upscale. There was a vast selection of creative vegetarian dishes to choose from served buffet style. *don't forget to look up as there is another entire level of dishes served above table level. Surprisingly, this newcomer is Swiss with several restaurants in Switzerland. Some of my guests were 'amazed' at how good everything was feeling less critical of vegan - vegetarian cuisine. I might add the management couldn't have been nicer. (they is a Bar and 'food to go')"
Late lunch,https://www.tripadvisor.com/ShowUserReviews-g186338-d1016181-r448485895-Tibits-London_England.html,Our second visit to this restaurant and its fantastic fresh food. We both enjoyed a great selection of hot and cold items from an extensive selection of salads. Highly recommended.,Date of visit: January 2017,Late lunch,Our second visit to this restaurant and its fantastic fresh food. We both enjoyed a great selection of hot and cold items from an extensive selection of salads. Highly recommended.
One of my favourite in London,https://www.tripadvisor.com/ShowUserReviews-g186338-d1016181-r448323680-Tibits-London_England.html,"I have been here quite a few times and always had a good experience. I love the fact that you can choose your own food and go for seconds :)
The food is always excellent, and there's always something new to try! I absolutely love...More",Date of visit: April 2016,One of my favourite in London,"I have been here quite a few times and always had a good experience. I love the fact that you can choose your own food and go for seconds :)The food is always excellent, and there's always something new to try! I absolutely love the green beans salad, it is my favorite!! I want to go for breakfast soon, and try out their options."
Indian rice pudding is glorious!,https://www.tripadvisor.com/ShowUserReviews-g186338-d1016181-r447485388-Tibits-London_England.html,"This was our first time in a vegetarian restaurant, and we were not disappointed. Admittedly, my husband and I found it much easier to eat than our 13, 11 and 7 year olds. There were a range of familiar hot foods which pleased the children...More,Thank you for your review. We look forward welcoming you back soon. 
Happy new year.",Date of visit: December 2016,Indian rice pudding is glorious!,"This was our first time in a vegetarian restaurant, and we were not disappointed. Admittedly, my husband and I found it much easier to eat than our 13, 11 and 7 year olds. There were a range of familiar hot foods which pleased the children - mushroom pasta, mashed potato and a sweet potato curry, but the stars of the show were the desserts - banoffee pie, berry mousse and sticky toffee pudding. My personal favourite was the Indian rice pudding, heavily flavoured with cardamon. I liked it so much I ate £8.60 worth!We sat downstairs which was fab as there is a small childrens book area and our youngest was very happy there.We will definitely be back. I have only rated it a 4 because it did seem a bit pricey."
,,,,,
Excellent range of options for Coeliac Vegetarians,https://www.tripadvisor.com/ShowUserReviews-g186338-d1016181-r446679072-Tibits-London_England.html,"As in Switzerland (CH), the Tibits in the English capital provides a good range of clearly labelled  and delicious options.  The atmosphere is cosy. I was pleased to introduce an English friend to the Tibits concept and he said that he would certainly return. The...More,Thank you for visiting us and for your review. We look forward welcoming you soon. Happy new year",Date of visit: November 2016,Excellent range of options for Coeliac Vegetarians,"As in Switzerland (CH), the Tibits in the English capital provides a good range of clearly labelled and delicious options. The atmosphere is cosy. I was pleased to introduce an English friend to the Tibits concept and he said that he would certainly return. The only comment is that the staff were very much less friendly than in all the Tibits I've visited in CH over the years. We would absolutely love to have a Tibits in Scotland especially in Edinburgh and Glasgow."
Healthy and tasty! Yep it's 100% possible!,https://www.tripadvisor.com/ShowUserReviews-g186338-d1016181-r445859330-Tibits-London_England.html,"I'm a Health Coach so for me this is HEAVEN! The food is very healthy, looks fresh and delicious and it tastes exactly like it looks - amazing. Also, the atmosphere is relaxing, the music is nice ,and the outdoor terrace is such a joy...More,Thank you for visiting us HealthySpirit . We look forward welcoming you soon. Happy new year",Date of visit: August 2016,Healthy and tasty! Yep it's 100% possible!,"I'm a Health Coach so for me this is HEAVEN! The food is very healthy, looks fresh and delicious and it tastes exactly like it looks - amazing. Also, the atmosphere is relaxing, the music is nice ,and the outdoor terrace is such a joy during the summer. Vegans, vegetarians, health fanatics - reunite! :)"
Excellent - Loved it,https://www.tripadvisor.com/ShowUserReviews-g186338-d1016181-r445529454-Tibits-London_England.html,"We stumbled upon this place by chance as daughter took a turn to soon.

Fabulous place with fabulous food. Great concept and no meat in sight.

Loved it and when we next in London, we will definitely be visiting.,Thank you for your review. Happy you liked it. 
See you soon.",Date of visit: December 2016,Excellent - Loved it,"We stumbled upon this place by chance as daughter took a turn to soon.Fabulous place with fabulous food. Great concept and no meat in sight.Loved it and when we next in London, we will definitely be visiting."
18th birthday treat,https://www.tripadvisor.com/ShowUserReviews-g186338-d1016181-r442689974-Tibits-London_England.html,"I took my daughter here as a birthday treat as she has always wanted to visit this restaurant and we'd heard great things about it. We were not disappointed. We went on a Friday evening and although it was packed, there was a great range...More,Thank you Angela. We are happy you and your daughter enjoyed your celebration with us.
Have a happy new year.
Morgane",Date of visit: December 2016,18th birthday treat,"I took my daughter here as a birthday treat as she has always wanted to visit this restaurant and we'd heard great things about it. We were not disappointed. We went on a Friday evening and although it was packed, there was a great range of foods available. I'd like to say a particular thank you to Morgane & to the amazing staff for helping to make the birthday surprise such a success!"
