Title,Title_link,partial_entry,rev_wrap,Headline,Field1
Vegan buffe in trendy setting,https://www.tripadvisor.com/ShowUserReviews-g186338-d1016181-r537409516-Tibits-London_England.html,"Love the buffe, the setting in calm Heddon street just off Regent street , beside Burberry ! 

Hidden gem with great selection of dishes , lunch comes with a plate and you pay per weight , lunch 2,5£ per 100 gr ! Somewhat pricey perhaps...More","<img src=""https://media-cdn.tripadvisor.com/media/photo-l/11/22/d6/36/photo0jpg.jpg""  class=""centeredImg noscript"" style="" min-width:70px; "" width=""100%""data-mediaid=""287495734"" /> > <img src=""https://media-cdn.tripadvisor.com/media/photo-l/11/22/d6/37/photo1jpg.jpg""  class=""centeredImg noscript"" style="" min-width:70px; "" width=""100%""data-mediaid=""287495735"" /> >",Vegan buffe in trendy setting,"Love the buffe, the setting in calm Heddon street just off Regent street , beside Burberry ! Hidden gem with great selection of dishes , lunch comes with a plate and you pay per weight , lunch 2,5£ per 100 gr ! Somewhat pricey perhaps but worth it I feel !"
"Great concept, but overpriced",https://www.tripadvisor.com/ShowUserReviews-g186338-d1016181-r536246356-Tibits-London_England.html,"Unique concept of completely vegetarian option buffet. However I found it to be lot of salads and not a great variety of cooked vegetarian hot dishes to eat.

It's also overpriced.. maybe because its in Mayfair? but to have to serve yourself, go to the...More",Date of visit: November 2016,"Great concept, but overpriced","Unique concept of completely vegetarian option buffet. However I found it to be lot of salads and not a great variety of cooked vegetarian hot dishes to eat.It's also overpriced.. maybe because its in Mayfair? but to have to serve yourself, go to the counter and get your plate weighed and pay.. might as well go to a sit down vegetarian restaurant."
Delicious vegetarian buffet.,https://www.tripadvisor.com/ShowUserReviews-g186338-d1016181-r534596356-Tibits-London_England.html,"VENUE
Situated on a pretty side street in Mayfair, the interior of this restaurant is clean, modern and relaxed. The seating may be a little utilitarian for some, but overall this is a nice place for a meal.

FOOD
This serve yourself restaurant serves tasty...More",Date of visit: September 2017,Delicious vegetarian buffet.,"VENUESituated on a pretty side street in Mayfair, the interior of this restaurant is clean, modern and relaxed. The seating may be a little utilitarian for some, but overall this is a nice place for a meal.FOODThis serve yourself restaurant serves tasty vegetarian cuisine and charges by weight. I have been here twice now and the selection was almost 100% different from one occasion to the next. I had a bit of everything and it was all delicious. Even meat-eaters will find plenty that they can enjoy here.SERVICEThere is no ‘service’ in the classic sense because the restaurant is self-service, however the staff are polite and friendly."
My favourite restaurant - a real gem,https://www.tripadvisor.com/ShowUserReviews-g186338-d1016181-r534367139-Tibits-London_England.html,I have been going to tibits for going on ten years now - maybe even longer. It has only gotten better with time. Getting a takeaway box is also a great idea and eating it in Green Park makes for one of my favourite days...More,Date of visit: September 2017,My favourite restaurant - a real gem,I have been going to tibits for going on ten years now - maybe even longer. It has only gotten better with time. Getting a takeaway box is also a great idea and eating it in Green Park makes for one of my favourite days out. Most of the foo dis vegan I would say and it is very clearly signposted as to what is and what isn't. After a few visits you get the hang of not mixing up your food if you don't want - I even put dessert and main dishes in my takeaway box and they end up fine. Very tasty food and it may be slightly expensive but totally worth it. The heavier foods do end up costing more but they should fill you up more so there is logic in their pay for what you take system as this also reduces waste and it isn't poor quality buffet food anyway. The juices are also great although I would always recommend the passionfruit lemonade.
Healthy & tasty food,https://www.tripadvisor.com/ShowUserReviews-g186338-d1016181-r534232443-Tibits-London_England.html,A spacious cafe with nice outdoor area. The food offered is healthy. There is a salad bar and the ingredients are fresh. Dressings are addictive. I ended my meal with tasty Indian tea. Good serive and prices.,Date of visit: October 2017,Healthy & tasty food,A spacious cafe with nice outdoor area. The food offered is healthy. There is a salad bar and the ingredients are fresh. Dressings are addictive. I ended my meal with tasty Indian tea. Good serive and prices.
Lunch with my children,https://www.tripadvisor.com/ShowUserReviews-g186338-d1016181-r533152794-Tibits-London_England.html,"Delicious food, all vegan on a Tuesday when we visited. There is so much variety, I could've eaten everything! Amazing textures and flavours, not the stereotype some people would expect for vegan food. Absolutely nothing could be done to improve it!",Date of visit: October 2017,Lunch with my children,"Delicious food, all vegan on a Tuesday when we visited. There is so much variety, I could've eaten everything! Amazing textures and flavours, not the stereotype some people would expect for vegan food. Absolutely nothing could be done to improve it!"
Great place..great food !,https://www.tripadvisor.com/ShowUserReviews-g186338-d1016181-r532699996-Tibits-London_England.html,They sell food by weight and if you are looking for good veg food then you must visit this place. It has a wide variety of Indian food stuff from veg biriyani to daal tadka and I just loved it. Much better than those fake...More,Date of visit: October 2017,Great place..great food !,They sell food by weight and if you are looking for good veg food then you must visit this place. It has a wide variety of Indian food stuff from veg biriyani to daal tadka and I just loved it. Much better than those fake Michelin star restaurants like Benaras and Tamarind in the area !
Definitely one of my favourite places for lunch in central London,https://www.tripadvisor.com/ShowUserReviews-g186338-d1016181-r532051688-Tibits-London_England.html,"If you are in central London near Regent Street then it is well worth seeking out this really good vegetarian restaurant. 
It is unusual in that you serve yourself to a delicious range of truly delicious veggie food (vegan on Tuesdays) and then you have...More",Date of visit: September 2017,Definitely one of my favourite places for lunch in central London,If you are in central London near Regent Street then it is well worth seeking out this really good vegetarian restaurant. It is unusual in that you serve yourself to a delicious range of truly delicious veggie food (vegan on Tuesdays) and then you have your plate weighed and pay accordingly. I just love it and also their range of fruit cocktails. You really don't have to be a vegetarian to enjoy this place - I often take friends and they like it too and often go back too.
veggie love,https://www.tripadvisor.com/ShowUserReviews-g186338-d1016181-r531056206-Tibits-London_England.html,"Interesting good place, found it funky and the menu is at its best.
waiting staff is good and i will come back for more",Date of visit: October 2017,veggie love,"Interesting good place, found it funky and the menu is at its best.waiting staff is good and i will come back for more"
So much Heathy food to choose from!,https://www.tripadvisor.com/ShowUserReviews-g186338-d1016181-r528327983-Tibits-London_England.html,"Think Whole Foods Salad Bar multiplied by 10. This is a restaurant where the food is weighed and you get to choose from many delicious vegan/vegetarian dishes, salads/ appetizers, and desserts. There's also drinks but I can't remember the separate price for those. I got...More","<img src=""https://media-cdn.tripadvisor.com/media/photo-l/10/d0/fa/92/vegetarian-a-la-carte.jpg""  class=""centeredImg noscript"" style="" min-width:70px; "" width=""100%""data-mediaid=""282131090"" /> > <img src=""https://media-cdn.tripadvisor.com/media/photo-l/10/d0/fa/96/the-receipt-for-the-meal.jpg""  class=""centeredImg noscript"" style="" min-width:70px; "" width=""100%""data-mediaid=""282131094"" /> >",So much Heathy food to choose from!,"Think Whole Foods Salad Bar multiplied by 10. This is a restaurant where the food is weighed and you get to choose from many delicious vegan/vegetarian dishes, salads/ appetizers, and desserts. There's also drinks but I can't remember the separate price for those. I got a pretty good sized meal, including quinoa cakes, samosas, salads, and vegan raspberry cheesecake. Yum. The price was reasonable too, about 13 GBP or $16 U.S. dollars. It's an actual restaurant and the ambience is delightful. There's no grocery store attached like at Whole Foods. You won't be disappointed if you are a vegan or vegetarian or have a special diet because every item has the ingredients listed."
,,,,,
Good for vegans,https://www.tripadvisor.com/ShowUserReviews-g186338-d1016181-r527965663-Tibits-London_England.html,I do enjoy eating here although not a vegan or vegetarian myself.  There is a wide range of tasty dishes and its nice to try new things. Self service so can end up costing moe than you would think. Could do with a spruce up...More,Date of visit: May 2017,Good for vegans,I do enjoy eating here although not a vegan or vegetarian myself. There is a wide range of tasty dishes and its nice to try new things. Self service so can end up costing moe than you would think. Could do with a spruce up inside.
Dinner at Tibits,https://www.tripadvisor.com/ShowUserReviews-g186338-d1016181-r526950256-Tibits-London_England.html,"Early dinner we were there just before 6pm and the place was crowded almost to full. Big choice of salads, lovely vegan pasta with tofu, fresh apple carrot juice and overly vegan sausage roll. You must not miss their chocolate muse/fudge or whatever hot dish....More",Date of visit: September 2017,Dinner at Tibits,"Early dinner we were there just before 6pm and the place was crowded almost to full. Big choice of salads, lovely vegan pasta with tofu, fresh apple carrot juice and overly vegan sausage roll. You must not miss their chocolate muse/fudge or whatever hot dish. It was super amazing put vegan cream on top. Yum. Highly recommended."
£25 for some salad and an onion ring??,https://www.tripadvisor.com/ShowUserReviews-g186338-d1016181-r526852286-Tibits-London_England.html,Lovely concept and great to see more restaurants catering for vegans such as myself. However I was shocked to choose my food and then be confronted with a £25 bill for one plate of food and a drink. Food was okay but would not return...More,Date of visit: September 2017,£25 for some salad and an onion ring??,Lovely concept and great to see more restaurants catering for vegans such as myself. However I was shocked to choose my food and then be confronted with a £25 bill for one plate of food and a drink. Food was okay but would not return unless prices reduced by at least 50%. Go to Ethos instead!
Not worth it,https://www.tripadvisor.com/ShowUserReviews-g186338-d1016181-r526852035-Tibits-London_England.html,Very expensive for what you get and you come out STINKING of fried foods which is impossible to get rid of from your clothes. Would not return. The food is ok but not worth it.,Date of visit: September 2017,Not worth it,Very expensive for what you get and you come out STINKING of fried foods which is impossible to get rid of from your clothes. Would not return. The food is ok but not worth it.
Not that good,https://www.tripadvisor.com/ShowUserReviews-g186338-d1016181-r526340425-Tibits-London_England.html,"So expensive. The food was nothing special, just regular and even a little bit poor. 
Furthermore the restaurant is so impersonal,there is no contact with other people except pulling them...because its so packed",Date of visit: September 2017,Not that good,"So expensive. The food was nothing special, just regular and even a little bit poor. Furthermore the restaurant is so impersonal,there is no contact with other people except pulling them...because its so packed"
Tasty vegetarian restaurant - great location; lots of selection,https://www.tripadvisor.com/ShowUserReviews-g186338-d1016181-r526337294-Tibits-London_England.html,"My daughter and I ate lunch on the patio last Saturday and returned on Sunday with my brother-in-law, sister, niece and nephew.  My niece had previously discovered this restaurant and loved it.  The first Tidbits restaurant (it is a chain) opened in Switzerland in 2000...More",Date of visit: September 2017,Tasty vegetarian restaurant - great location; lots of selection,"My daughter and I ate lunch on the patio last Saturday and returned on Sunday with my brother-in-law, sister, niece and nephew. My niece had previously discovered this restaurant and loved it. The first Tidbits restaurant (it is a chain) opened in Switzerland in 2000 where my sister lives with her family.You select from a dazzling buffet and then you go and get your plate weighed. It is at this counter that you can order drinks. My daughter and I ordered lattes on the Saturday. My daughter's soy latte was made and she took our plates out to the patio table. I was waiting a bit so I asked the barista serving us if she could bring my latte out when it was done as I didn't want my food to get cold. She said that she was on her own so she couldn't do that. Then, another waitress behind the counter saw me standing there and asked if I needed a tray. I said that I was just waiting for my latte. She very kindly offered to bring my drink out when it was done which I very much appreciated. I must have chosen about 12 different things for my lunch (a little bit of this; a little bit of that!) on both days. It was really fun to try so many things!When my daughter and I ate there on Saturday, our two plates and two lattes cost 30 pounds."
Unusual format nice food friendly staff,https://www.tripadvisor.com/ShowUserReviews-g186338-d1016181-r526329830-Tibits-London_England.html,"I really like the concept. You find a table, take a plate and help yourself to a range of tasty dishes. Then you pay depending on the weight of the dish. No waiting, so it's great if you are on a short lunch break.

Lots...More",Date of visit: September 2017,Unusual format nice food friendly staff,"I really like the concept. You find a table, take a plate and help yourself to a range of tasty dishes. Then you pay depending on the weight of the dish. No waiting, so it's great if you are on a short lunch break.Lots of GF DF Vegan dishes to choose from, and the staff are very friendly. I wouldn't give it 5 stars as the food isn't spectacular but if I could give it 4.5 I would. I have eaten here four times already and will be back soon!"
Lovely tasty food!,https://www.tripadvisor.com/ShowUserReviews-g186338-d1016181-r526126582-Tibits-London_England.html,"There was lots to choose from. The Falafel tasted wonderful and the buffet style restaurant offered a range of different foods/vegetable dishes to choose from.    I loved the hot lemon and ginger drink.  The cakes on the counter also looked wonderful but I didn't indulge,...More",Date of visit: September 2017,Lovely tasty food!,"There was lots to choose from. The Falafel tasted wonderful and the buffet style restaurant offered a range of different foods/vegetable dishes to choose from. I loved the hot lemon and ginger drink. The cakes on the counter also looked wonderful but I didn't indulge, I chose the strawberry cream instead and baked chocolate pudding cake for dessert. It is a chance to eat out and feel good about what your food choices. All in all had a great time and would definitely return."
May be good for Vegans,https://www.tripadvisor.com/ShowUserReviews-g186338-d1016181-r526055474-Tibits-London_England.html,A group of ten us visited this restaurants for dinner following a recommendation. Whilst our vegan friends loved the food we were not well in our stomachs the next day possibly because of some the oil reach selection we chose. The food was well presented...More,Date of visit: September 2017,May be good for Vegans,"A group of ten us visited this restaurants for dinner following a recommendation. Whilst our vegan friends loved the food we were not well in our stomachs the next day possibly because of some the oil reach selection we chose. The food was well presented and looks very tasty. Bearing in mind the portion size the cost of the meal did not represent good value for money. Service could improve - it took ages for the staff to remove the plates. The restaurant’s basement seemed very child friendly, which is definitely a bonus.We shall not return here but may recommend this restaurant to our vegan friends and family members."
Yum Yum Yummy Veggies,https://www.tripadvisor.com/ShowUserReviews-g186338-d1016181-r525659829-Tibits-London_England.html,"Tibits is a yummy vegetarian restaurant in the heart of the city.The option available are well cooked and taste amazing.The restaurant has more of salads, and with a self service option.The food is charged as per weight.

The next important point is that they have...More",Date of visit: May 2017,Yum Yum Yummy Veggies,"Tibits is a yummy vegetarian restaurant in the heart of the city.The option available are well cooked and taste amazing.The restaurant has more of salads, and with a self service option.The food is charged as per weight.The next important point is that they have a kids corner where toys, games, papers with colours are available to keep them busy while you enjoy your meal."
,,,,,
Top vegan restaurant in London,https://www.tripadvisor.com/ShowUserReviews-g186338-d1016181-r525100143-Tibits-London_England.html,My husband and I have recently discovered the benefits and joy of a plant-based diet. Tibits gives vegan newbies the chance to taste small portions of a wide range of vegan and vegetarian food. We liked the food but I was a bit disappointed by...More,Date of visit: September 2017,Top vegan restaurant in London,My husband and I have recently discovered the benefits and joy of a plant-based diet. Tibits gives vegan newbies the chance to taste small portions of a wide range of vegan and vegetarian food. We liked the food but I was a bit disappointed by the amount of salt in the risotto. We will definitely go back but next time I will highlight the saltiness to the manager.
Perfect for vegetarian teen,https://www.tripadvisor.com/ShowUserReviews-g186338-d1016181-r524942668-Tibits-London_England.html,Stopped here for lunch on a shopping trip - good location off regent street. Choose from a selection of dishes and pay by weight. My daughter thought it great to have such a variety of foods and I didn't miss meat at all. Nice wine...More,Date of visit: September 2017,Perfect for vegetarian teen,Stopped here for lunch on a shopping trip - good location off regent street. Choose from a selection of dishes and pay by weight. My daughter thought it great to have such a variety of foods and I didn't miss meat at all. Nice wine and reasonable price for the area. Will return.
"Outstanding Location, Atmosphere, and Food",https://www.tripadvisor.com/ShowUserReviews-g186338-d1016181-r524217640-Tibits-London_England.html,"This is a strictly vegetarian restaurant with both exotic and familiar fare (there are salads but also curried quinoa and pumpkin soufflé). You enter and pick up a plate to fill at a long buffet ""bar"" and then you pay according to how much your...More",Date of visit: September 2017,"Outstanding Location, Atmosphere, and Food","This is a strictly vegetarian restaurant with both exotic and familiar fare (there are salads but also curried quinoa and pumpkin soufflé). You enter and pick up a plate to fill at a long buffet ""bar"" and then you pay according to how much your plate weighs. You then either take out or find a place to sit either inside or out. The decor is modern, warm, and inviting with comfortable seating. The restaurant is very large and the vibe is hip and relaxing. Its location off Regent Street makes it very accessible for both tourists and natives alike. I would highly recommend Tibits."
Great lunch,https://www.tripadvisor.com/ShowUserReviews-g186338-d1016181-r523781270-Tibits-London_England.html,"This is a great idea for a restaurant - how much you pay is based on the weight of your plate. So if you're looking for a light lunch for a reasonable price I would definitely recommend this. However, if you want a full plate...More",Date of visit: August 2017,Great lunch,"This is a great idea for a restaurant - how much you pay is based on the weight of your plate. So if you're looking for a light lunch for a reasonable price I would definitely recommend this. However, if you want a full plate of food it is slightly pricey, but the delicious food makes it worth it. Everything available is vegetarian and mostly vegan. My dessert of sticky toffee pudding was particularly nice. Would definitely visit again if I am in the area."
Very enjoyable,https://www.tripadvisor.com/ShowUserReviews-g186338-d1016181-r523490358-Tibits-London_England.html,Tibits has a lot going for it. There is a main buffet which has cold as well as hot food. The dishes vary from day to day- the salads are pretty much the same. You can also select desserts from the buffet. The food is...More,Date of visit: September 2017,Very enjoyable,Tibits has a lot going for it. There is a main buffet which has cold as well as hot food. The dishes vary from day to day- the salads are pretty much the same. You can also select desserts from the buffet. The food is fresh and depending on what you choose quite good. The location is excellent off the bustle of Regent street. You can sit outside in the heated courtyard which is lovely. Your plate is weighed after you make your selection and you then pay at the till. You can also hire out this venue for a private event. All in all very well run and reasonably priced.
"Nice food, nice format, nice place - but too expensive for me to go back",https://www.tripadvisor.com/ShowUserReviews-g186338-d1016181-r522672110-Tibits-London_England.html,"I have visited both London branches of this restaurant: Heddon Street and Southwark Street.  Both are nicely fitted-out, have pleasant staff and an imaginative, healthy, appetising range of vegetarian dishes on offer at their self-service buffet.  But the prices are very high - even for...More",Date of visit: August 2017,"Nice food, nice format, nice place - but too expensive for me to go back","I have visited both London branches of this restaurant: Heddon Street and Southwark Street. Both are nicely fitted-out, have pleasant staff and an imaginative, healthy, appetising range of vegetarian dishes on offer at their self-service buffet. But the prices are very high - even for takeaway, which is much lower than eat-in. It's a shame."
Different and trendy,https://www.tripadvisor.com/ShowUserReviews-g186338-d1016181-r521959762-Tibits-London_England.html,We had never been here before so had to understand that you choose your food on a buffet-type system then pay for it based on weight.  It is vegetarian/vegan.  Service was fine and food was delicious.  Good ambiance and nice decoration.,Date of visit: September 2017,Different and trendy,We had never been here before so had to understand that you choose your food on a buffet-type system then pay for it based on weight. It is vegetarian/vegan. Service was fine and food was delicious. Good ambiance and nice decoration.
Spoilt for choice,https://www.tripadvisor.com/ShowUserReviews-g186338-d1016181-r521759317-Tibits-London_England.html,"With Heddon Street and Bankside now available it's hard to choose between the two units 
Great veggie food in super ambience 
Whether u get a take away or have a long lunch or leisurely alcoholic dinner doesn't matter. It works for all 
Love the fact...More",Date of visit: September 2017,Spoilt for choice,With Heddon Street and Bankside now available it's hard to choose between the two units Great veggie food in super ambience Whether u get a take away or have a long lunch or leisurely alcoholic dinner doesn't matter. It works for all Love the fact Bankside convenient for so many theatres and if course Heddon st bang in middle of town U choose your own food. And the amount. So u get nothing u don't want. Highly recommended for veggies and carnivores alike
Rip Off,https://www.tripadvisor.com/ShowUserReviews-g186338-d1016181-r521031609-Tibits-London_England.html,"Poor quality buffet food, cryptically overpriced, zero service. Dont see the point. The mix of food confused my mouth and is really aweful value for money. Do everyone a favour and atleast make it all-you-can-eat if your going to serve food like that. £15 for...More",Date of visit: September 2017,Rip Off,"Poor quality buffet food, cryptically overpriced, zero service. Dont see the point. The mix of food confused my mouth and is really aweful value for money. Do everyone a favour and atleast make it all-you-can-eat if your going to serve food like that. £15 for a plate of snack food, left the place still hungry."
